<?xml version="1.0" encoding="UTF-8"?>

<psml Version="889923"
xmlns:xsi="http://www.w3.org/2001/XMLSchema-instance"
xsi:noNamespaceSchemaLocation="psml.xsd">

 <Jellyfish 
	Type="Static"
        Name="Alex"
	Resizeable="true">
    <Appearance
	Status="Alert"
	AspectRatio="0.25"
	Spacing="5"
	Mask="Rectangle.svg">
	
       <BlackHole/>
	<Style
		Border="Solid"
		FillColour="#11FA12">
		<Graphic
			Default="whatever.svg"/>
	</Style>
	 
	<Resize/>
	<Title/>
	<Bungee/>

    </Appearance>
 
  </Jellyfish>

</psml>
